{
  "run_id": "run_full",
  "timestamp": "2026-07-09T15:21:21.303930Z",
  "status": "configured",
  "config_path": "configs/experiments/run_full.yaml",
  "base_model": "meta-llama/Llama-3.2-1B-Instruct",
  "dataset_report_path": "runs/run_full/dataset_report.json",
  "steps_completed": 0,
  "active_stage": "training-configuration"
}